{
  "$schema": "./tour.schema.json",
  "schema_version": 1,
  "tour_id": "first-project",
  "version": 1,
  "title": "Your first project in OWI",
  "steps": [
    {
      "step_id": "meet-your-company",
      "view": "office",
      "target_anchor": "company-hq",
      "fallback_anchor": "company-hq",
      "coach_asset_id": "character-orbit-dispatcher-idle",
      "title": "Welcome to your AI company",
      "body": "You remain the owner. OWI helps turn one goal into reviewable tasks, proposes qualified workers, and keeps every important decision visible. The tour explains the workflow; it never spends money or runs a model for you.",
      "placement": "center",
      "next_label": "Meet the team"
    },
    {
      "step_id": "read-the-roster",
      "view": "office",
      "target_anchor": "office-roster",
      "fallback_anchor": "company-hq",
      "coach_asset_id": "character-orbit-dispatcher-idle",
      "title": "Know who is working",
      "body": "Each friendly character presents one stored worker record from the current mode. Read the exact worker ID, capability, and runner status below the artwork. A character name is presentation only and never hides the model identity; sample and read-only modes stay labelled.",
      "placement": "auto",
      "next_label": "Create a project"
    },
    {
      "step_id": "create-the-project",
      "view": "work",
      "target_anchor": "project-create",
      "fallback_anchor": "company-hq",
      "coach_asset_id": "character-orbit-dispatcher-idle",
      "title": "Give the office one clear goal",
      "body": "Name the project, describe the deliverable, choose privacy, and set an optional task-forecast budget. Planning-model use stays off unless you explicitly enable it, and sensitive projects keep it disabled.",
      "placement": "auto",
      "next_label": "Inspect the tasks"
    },
    {
      "step_id": "inspect-the-plan",
      "view": "work",
      "target_anchor": "task-board",
      "fallback_anchor": "project-create",
      "coach_asset_id": "character-orbit-dispatcher-idle",
      "title": "Shape small, checkable tasks",
      "body": "Review every draft before spending. Add, edit, or remove tasks, keep different kinds of work separate, and write acceptance checks that make the returned result easy to judge.",
      "placement": "auto",
      "next_label": "Staff the work"
    },
    {
      "step_id": "approve-the-staffing",
      "view": "work",
      "target_anchor": "staffing",
      "fallback_anchor": "task-board",
      "coach_asset_id": "character-orbit-dispatcher-idle",
      "title": "Compare the proposed staff",
      "body": "Staffing evaluates capability, tools, privacy, quality evidence, and price for each task. Inspect the selected worker, qualified alternatives, exclusions, runner readiness, and accepted-result cost forecast before execution.",
      "placement": "auto",
      "next_label": "Run and review"
    },
    {
      "step_id": "review-the-delivery",
      "view": "work",
      "target_anchor": "run-review",
      "fallback_anchor": "task-board",
      "coach_asset_id": "character-orbit-dispatcher-idle",
      "title": "Run only the saved assignment",
      "body": "The Run control uses the exact staffed worker and server-owned brief. When it finishes, inspect the real output and checks. Accept it, send it back, retry the same assignment, or restaff using new evidence.",
      "placement": "auto",
      "next_label": "See the evidence"
    },
    {
      "step_id": "understand-the-results",
      "view": "results",
      "target_anchor": "results-evidence",
      "fallback_anchor": "company-hq",
      "coach_asset_id": "character-orbit-dispatcher-idle",
      "title": "Manage with evidence",
      "body": "Results keeps outcomes beside the exact worker and task. Forecasts remain forecasts; actual spend, savings, CO₂, and water stay unknown until receipts or measured evidence exist. You can restart this tour whenever you need it.",
      "placement": "auto",
      "next_label": "Finish tour"
    }
  ]
}
